slot	abstract	alias	aliases	annotations	broad_mappings	close_mappings	comments	conforms_to	deprecated	description	designates_type	domain	domain_of	enum_range	exact_mappings	examples	from_schema	identifier	ifabsent	implicit_prefix	imported_from	in_language	in_subset	inlined	inlined_as_list	is_a	is_grouping_slot	is_usage_slot	key	local_names	mappings	maximum_cardinality	maximum_value	minimum_cardinality	minimum_value	mixin	mixins	multivalued	narrow_mappings 	notes	pattern	range	rank	readonly	recommended	related_mappings	required	see_also	slot_group	slot_uri	source	status	string_serialization	structured_pattern	subproperty_of	title	todos	unit	usage_slot_name
> slot	abstract	alias	aliases	ignore	broad_mappings	close_mappings	comments	conforms_to	deprecated	description	designates_type	domain	domain_of	enum_range	exact_mappings	examples	from_schema	identifier	ifabsent	implicit_prefix	imported_from	in_language	in_subset	inlined	inlined_as_list	is_a	is_grouping_slot	is_usage_slot	key	local_names	mappings	maximum_cardinality	maximum_value	minimum_cardinality	minimum_value	mixin	mixins	multivalued	narrow_mappings 	notes	pattern	range	rank	readonly	recommended	related_mappings	required	see_also	slot_group	slot_uri	source	status	string_serialization	structured_pattern	subproperty_of	title	todos	unit	usage_slot_name
>			internal_separator: “|”		internal_separator: “|”	internal_separator: “|”	internal_separator: “|”						internal_separator: “|”		internal_separator: “|”	internal_separator: “|”							internal_separator: “|”							internal_separator: “|”	internal_separator: “|”						internal_separator: “|”		internal_separator: “|”	internal_separator: “|”						internal_separator: “|”		internal_separator: “|”									internal_separator: “|”		
abs_air_humidity			absolute air humidity							Actual mass of water vapor - mh20 - present in the air water vapor mixture						9 gram per gram	https://microbiomedata/schema/mixs									core field												false				QuantityValue								MIXS:0000122						absolute air humidity			
add_recov_method			secondary and tertiary recovery methods and start date							"Additional (i.e. Secondary, tertiary, etc.) recovery methods deployed for increase of hydrocarbon recovery from resource and start date for each one of them. If ""other"" is specified, please propose entry in ""additional info"" field"						Polymer Addition;2018-06-21T14:30Z	https://microbiomedata/schema/mixs									core field												false				TextValue								MIXS:0001009						secondary and tertiary recovery methods and start date			
additional_info			additional info							Information that doesn't fit anywhere else. Can also be used to propose new entries for fields with controlled vocabulary							https://microbiomedata/schema/mixs									core field												false				TextValue								MIXS:0000300			{text}			additional info			
address			address							The street name and building number where the sampling occurred.							https://microbiomedata/schema/mixs									core field												false				TextValue								MIXS:0000218			{integer}{text}			address			
adj_room			adjacent rooms							List of rooms (room number, room name) immediately adjacent to the sampling room							https://microbiomedata/schema/mixs									core field												false				TextValue								MIXS:0000219			{text};{integer}			adjacent rooms			
aero_struc			aerospace structure							Aerospace structures typically consist of thin plates with stiffeners for the external surfaces, bulkheads and frames to support the shape and fasteners such as welds, rivets, screws and bolts to hold the components together						plane	https://microbiomedata/schema/mixs									core field												false				TextValue								MIXS:0000773			[plane|glider]			aerospace structure			
agrochem_addition			history/agrochemical additions							Addition of fertilizers, pesticides, etc. - amount and time of applications						roundup;5 milligram per liter;2018-06-21	https://microbiomedata/schema/mixs									core field												true				TextValue								MIXS:0000639			{text};{float} {unit};{timestamp}			history/agrochemical additions			
air_PM_concen			air particulate matter concentration							Concentration of substances that remain suspended in the air, and comprise mixtures of organic and inorganic substances (PM10 and PM2.5); can report multiple PM's by entering numeric values preceded by name of PM						PM2.5;10 microgram per cubic meter	https://microbiomedata/schema/mixs									core field												true				TextValue								MIXS:0000108			{text};{float} {unit}			air particulate matter concentration			
air_temp			air temperature							Temperature of the air at the time of sampling						20 degree Celsius	https://microbiomedata/schema/mixs									core field												false				QuantityValue								MIXS:0000124						air temperature			
air_temp_regm			air temperature regimen							Information about treatment involving an exposure to varying temperatures; should include the temperature, treatment regimen including how many times the treatment was repeated, how long each treatment lasted, and the start and end time of the entire treatment; can include different temperature regimens						25 degree Celsius;R2/2018-05-11T14:30/2018-05-11T19:30/P1H30M	https://microbiomedata/schema/mixs									core field												true				TextValue								MIXS:0000551			{float} {unit};{Rn/start_time/end_time/duration}			air temperature regimen			
al_sat			extreme_unusual_properties/Al saturation							Aluminum saturation (esp. For tropical soils)							https://microbiomedata/schema/mixs									core field												false				QuantityValue								MIXS:0000607						extreme_unusual_properties/Al saturation			
al_sat_meth			extreme_unusual_properties/Al saturation method							Reference or method used in determining Al saturation							https://microbiomedata/schema/mixs									core field												false				TextValue								MIXS:0000324			{PMID}|{DOI}|{URL}			extreme_unusual_properties/Al saturation method			
alkalinity			alkalinity							Alkalinity, the ability of a solution to neutralize acids to the equivalence point of carbonate or bicarbonate						50 milligram per liter	https://microbiomedata/schema/mixs									core field												false				QuantityValue								MIXS:0000421						alkalinity			
alkalinity_method			alkalinity method							Method used for alkalinity measurement						titration	https://microbiomedata/schema/mixs									core field												false				TextValue								MIXS:0000298			{text}			alkalinity method			
alkyl_diethers			alkyl diethers							Concentration of alkyl diethers						0.005 mole per liter	https://microbiomedata/schema/mixs									core field												false				QuantityValue								MIXS:0000490						alkyl diethers			
alt			altitude							Altitude is a term used to identify heights of objects such as airplanes, space shuttles, rockets, atmospheric balloons and heights of places such as atmospheric layers and clouds. It is used to measure the height of an object which is above the earth's surface. In this context, the altitude measurement is the vertical distance between the earth's surface above sea level and the sampled position in the air						100 meter	https://microbiomedata/schema/mixs									environment field												false				QuantityValue								MIXS:0000094						altitude			
aminopept_act			aminopeptidase activity							Measurement of aminopeptidase activity						0.269 mole per liter per hour	https://microbiomedata/schema/mixs									core field												false				QuantityValue								MIXS:0000172						aminopeptidase activity			
ammonium			ammonium							Concentration of ammonium in the sample						1.5 milligram per liter	https://microbiomedata/schema/mixs									core field												false				QuantityValue								MIXS:0000427						ammonium			
amount_light			amount of light							The unit of illuminance and luminous emittance, measuring luminous flux per unit area							https://microbiomedata/schema/mixs									core field												false				QuantityValue								MIXS:0000140						amount of light			
ances_data			ancestral data							Information about either pedigree or other ancestral information description (e.g. parental variety in case of mutant or selection), e.g. A/3*B (meaning [(A x B) x B] x B)						A/3*B	https://microbiomedata/schema/mixs									core field												false				TextValue								MIXS:0000247			{text}			ancestral data			
annual_precpt			mean annual precipitation							The average of all annual precipitation values known, or an estimated equivalent value derived by such methods as regional indexes or Isohyetal maps.							https://microbiomedata/schema/mixs									core field												false				QuantityValue								MIXS:0000644						mean annual precipitation			
annual_temp			mean annual temperature							Mean annual temperature						12.5 degree Celsius	https://microbiomedata/schema/mixs									core field												false				QuantityValue								MIXS:0000642						mean annual temperature			
antibiotic_regm			antibiotic regimen							Information about treatment involving antibiotic administration; should include the name of antibiotic, amount administered, treatment regimen including how many times the treatment was repeated, how long each treatment lasted, and the start and end time of the entire treatment; can include multiple antibiotic regimens						penicillin;5 milligram;R2/2018-05-11T14:30/2018-05-11T19:30/P1H30M	https://microbiomedata/schema/mixs									core field												true				TextValue								MIXS:0000553			{text};{float} {unit};{Rn/start_time/end_time/duration}			antibiotic regimen			
api			API gravity							API gravity is a measure of how heavy or light a petroleum liquid is compared to water (source: https://en.wikipedia.org/wiki/API_gravity) (e.g. 31.1¬∞ API)							https://microbiomedata/schema/mixs									core field												false				QuantityValue								MIXS:0000157						API gravity			
arch_struc			architectural structure							An architectural structure is a human-made, free-standing, immobile outdoor construction						shed	https://microbiomedata/schema/mixs									core field												false				arch_struc_enum								MIXS:0000774						architectural structure			
aromatics_pc			aromatics wt%							Saturate, Aromatic, Resin and Asphaltene¬†(SARA) is an analysis method that divides¬†crude oil¬†components according to their polarizability and polarity. There are three main methods to obtain SARA results. The most popular one is known as the Iatroscan TLC-FID and is referred to as IP-143 (source: https://en.wikipedia.org/wiki/Saturate,_aromatic,_resin_and_asphaltene)							https://microbiomedata/schema/mixs									core field												false				TextValue								MIXS:0000133			{text};{float} {unit}			aromatics wt%			
asphaltenes_pc			asphaltenes wt%							Saturate, Aromatic, Resin and Asphaltene¬†(SARA) is an analysis method that divides¬†crude oil¬†components according to their polarizability and polarity. There are three main methods to obtain SARA results. The most popular one is known as the Iatroscan TLC-FID and is referred to as IP-143 (source: https://en.wikipedia.org/wiki/Saturate,_aromatic,_resin_and_asphaltene)							https://microbiomedata/schema/mixs									core field												false				TextValue								MIXS:0000135			{text};{float} {unit}			asphaltenes wt%			
atmospheric_data			atmospheric data							Measurement of atmospheric data; can include multiple data						wind speed;9 knots	https://microbiomedata/schema/mixs									core field												true				TextValue								MIXS:0001097			{text};{float} {unit}			atmospheric data			
avg_dew_point			average dew point							The average of dew point measures taken at the beginning of every hour over a 24 hour period on the sampling day						25.5 degree Celsius	https://microbiomedata/schema/mixs									core field												false				QuantityValue								MIXS:0000141						average dew point			
avg_occup			average daily occupancy							Daily average occupancy of room. Indicate the number of person(s) daily occupying the sampling room.						2	https://microbiomedata/schema/mixs									core field												false				double								MIXS:0000775						average daily occupancy			
avg_temp			average temperature							The average of temperatures taken at the beginning of every hour over a 24 hour period on the sampling day						12.5 degree Celsius	https://microbiomedata/schema/mixs									core field												false				QuantityValue								MIXS:0000142						average temperature			
bac_prod			bacterial production							Bacterial production in the water column measured by isotope uptake						5 milligram per cubic meter per day	https://microbiomedata/schema/mixs									core field												false				QuantityValue								MIXS:0000683						bacterial production			
bac_resp			bacterial respiration							Measurement of bacterial respiration in the water column						300 micromole oxygen per liter per hour	https://microbiomedata/schema/mixs									core field												false				QuantityValue								MIXS:0000684						bacterial respiration			
bacteria_carb_prod			bacterial carbon production							Measurement of bacterial carbon production						2.53 microgram per liter per hour	https://microbiomedata/schema/mixs									core field												false				QuantityValue								MIXS:0000173						bacterial carbon production			
barometric_press			barometric pressure							Force per unit area exerted against a surface by the weight of air above that surface						5 millibar	https://microbiomedata/schema/mixs									core field												false				QuantityValue								MIXS:0000096						barometric pressure			
basin			basin name							Name of the basin (e.g. Campos)							https://microbiomedata/schema/mixs									core field												false				TextValue								MIXS:0000290			{text}			basin name			
bathroom_count			bathroom count							The number of bathrooms in the building						1	https://microbiomedata/schema/mixs									core field												false				integer								MIXS:0000776						bathroom count			
bedroom_count			bedroom count							The number of bedrooms in the building						2	https://microbiomedata/schema/mixs									core field												false				integer								MIXS:0000777						bedroom count			
benzene			benzene							Concentration of benzene in the sample							https://microbiomedata/schema/mixs									core field												false				QuantityValue								MIXS:0000153						benzene			
biochem_oxygen_dem			biochemical oxygen demand							Amount of dissolved oxygen needed by aerobic biological organisms in a body of water to break down organic material present in a given water sample at certain temperature over a specific time period							https://microbiomedata/schema/mixs									core field												false				QuantityValue								MIXS:0000653						biochemical oxygen demand			
biocide			biocide administration							List of biocides (commercial name of product and supplier) and date of administration						ALPHA 1427;Baker Hughes;2008-01-23	https://microbiomedata/schema/mixs									core field												false				TextValue								MIXS:0001011			{text};{text};{timestamp}			biocide administration			
biocide_admin_method			biocide administration method							Method of biocide administration (dose, frequency, duration, time elapsed between last biociding and sampling) (e.g. 150 mg/l; weekly; 4 hr; 3 days)							https://microbiomedata/schema/mixs									core field												false				TextValue								MIXS:0000456			{float} {unit};{Rn/start_time/end_time/duration};{duration}			biocide administration method			
biol_stat			biological status							The level of genome modification.						natural	https://microbiomedata/schema/mixs									core field												false				biol_stat_enum								MIXS:0000858						biological status			
biomass			biomass							Amount of biomass; should include the name for the part of biomass measured, e.g. Microbial, total. Can include multiple measurements						total;20 gram	https://microbiomedata/schema/mixs									core field												true				TextValue								MIXS:0000174			{text};{float} {unit}			biomass			
biotic_regm			biotic regimen							Information about treatment(s) involving use of biotic factors, such as bacteria, viruses or fungi.						sample inoculated with Rhizobium spp. Culture	https://microbiomedata/schema/mixs									core field												false				TextValue								MIXS:0001038			{text}			biotic regimen			
biotic_relationship			observed biotic relationship							Description of relationship(s) between the subject organism and other organism(s) it is associated with. E.g., parasite on species X; mutualist with species Y. The target organism is the subject of the relationship, and the other organism(s) is the object						free living	https://microbiomedata/schema/mixs									nucleic acid sequence source field												false				biotic_relationship_enum								MIXS:0000028						observed biotic relationship			
bishomohopanol			bishomohopanol							Concentration of bishomohopanol						14 microgram per liter	https://microbiomedata/schema/mixs									core field												false				QuantityValue								MIXS:0000175						bishomohopanol			
blood_press_diast			host blood pressure diastolic							Resting diastolic blood pressure, measured as mm mercury							https://microbiomedata/schema/mixs									core field												false				QuantityValue								MIXS:0000258						host blood pressure diastolic			
blood_press_syst			host blood pressure systolic							Resting systolic blood pressure, measured as mm mercury							https://microbiomedata/schema/mixs									core field												false				QuantityValue								MIXS:0000259						host blood pressure systolic			
bromide			bromide							Concentration of bromide						0.05 parts per million	https://microbiomedata/schema/mixs									core field												false				QuantityValue								MIXS:0000176						bromide			
build_docs			design, construction, and operation documents							The building design, construction and operation documents						maintenance plans	https://microbiomedata/schema/mixs									core field												false				build_docs_enum								MIXS:0000787						design, construction, and operation documents			
build_occup_type			building occupancy type							The primary function for which a building or discrete part of a building is intended to be used						market	https://microbiomedata/schema/mixs									core field												true				build_occup_type_enum								MIXS:0000761						building occupancy type			
building_setting			building setting							A location (geography) where a building is set						rural	https://microbiomedata/schema/mixs									core field												false				building_setting_enum								MIXS:0000768						building setting			
built_struc_age			built structure age							The age of the built structure since construction						15	https://microbiomedata/schema/mixs									core field												false				QuantityValue								MIXS:0000145						built structure age			
built_struc_set			built structure setting							The characterization of the location of the built structure as high or low human density						rural	https://microbiomedata/schema/mixs									core field												false				TextValue								MIXS:0000778			[urban|rural]			built structure setting			
built_struc_type			built structure type							A physical structure that is a body or assemblage of bodies in space to form a system capable of supporting loads							https://microbiomedata/schema/mixs									core field												false				TextValue								MIXS:0000721			{text}			built structure type			
calcium			calcium							Concentration of calcium in the sample						0.2 micromole per liter	https://microbiomedata/schema/mixs									core field												false				QuantityValue								MIXS:0000432						calcium			
carb_dioxide			carbon dioxide							Carbon dioxide (gas) amount or concentration at the time of sampling						410 parts per million	https://microbiomedata/schema/mixs									core field												false				QuantityValue								MIXS:0000097						carbon dioxide			
carb_monoxide			carbon monoxide							Carbon monoxide (gas) amount or concentration at the time of sampling						0.1 parts per million	https://microbiomedata/schema/mixs									core field												false				QuantityValue								MIXS:0000098						carbon monoxide			
carb_nitro_ratio			carbon/nitrogen ratio							Ratio of amount or concentrations of carbon to nitrogen						0.417361111	https://microbiomedata/schema/mixs									core field												false				QuantityValue								MIXS:0000310						carbon/nitrogen ratio			
ceil_area			ceiling area							The area of the ceiling space within the room						25 square meter	https://microbiomedata/schema/mixs									core field												false				QuantityValue								MIXS:0000148						ceiling area			
ceil_cond			ceiling condition							The physical condition of the ceiling at the time of sampling; photos or video preferred; use drawings to indicate location of damaged areas						damaged	https://microbiomedata/schema/mixs									core field												false				ceil_cond_enum								MIXS:0000779						ceiling condition			
ceil_finish_mat			ceiling finish material							The type of material used to finish a ceiling						stucco	https://microbiomedata/schema/mixs									core field												false				ceil_finish_mat_enum								MIXS:0000780						ceiling finish material			
ceil_struc			ceiling structure							The construction format of the ceiling						concrete	https://microbiomedata/schema/mixs									core field												false				TextValue								MIXS:0000782			[wood frame|concrete]			ceiling structure			
ceil_texture			ceiling texture							The feel, appearance, or consistency of a ceiling surface						popcorn	https://microbiomedata/schema/mixs									core field												false				ceil_texture_enum								MIXS:0000783						ceiling texture			
ceil_thermal_mass			ceiling thermal mass							The ability of the ceiling to provide inertia against temperature fluctuations. Generally this means concrete that is exposed. A metal deck that supports a concrete slab will act thermally as long as it is exposed to room air flow							https://microbiomedata/schema/mixs									core field												false				QuantityValue								MIXS:0000143						ceiling thermal mass			
ceil_type			ceiling type							The type of ceiling according to the ceiling's appearance or construction						coffered	https://microbiomedata/schema/mixs									core field												false				ceil_type_enum								MIXS:0000784						ceiling type			
ceil_water_mold			ceiling signs of water/mold							Signs of the presence of mold or mildew on the ceiling						presence of mold visible	https://microbiomedata/schema/mixs									core field												false				TextValue								MIXS:0000781			[presence of mold visible|no presence of mold visible]			ceiling signs of water/mold			
chem_administration			chemical administration							List of chemical compounds administered to the host or site where sampling occurred, and when (e.g. Antibiotics, n fertilizer, air filter); can include multiple compounds. For chemical entities of biological interest ontology (chebi) (v 163), http://purl.bioontology.org/ontology/chebi						agar [CHEBI:2509];2018-05-11T20:00Z	https://microbiomedata/schema/mixs									core field												true				TextValue								MIXS:0000751			{termLabel} {[termID]};{timestamp}			chemical administration			
chem_mutagen			chemical mutagen							Treatment involving use of mutagens; should include the name of mutagen, amount administered, treatment regimen including how many times the treatment was repeated, how long each treatment lasted, and the start and end time of the entire treatment; can include multiple mutagen regimens						nitrous acid;0.5 milligram per liter;R2/2018-05-11T14:30/2018-05-11T19:30/P1H30M	https://microbiomedata/schema/mixs									core field												true				TextValue								MIXS:0000555			{text};{float} {unit};{Rn/start_time/end_time/duration}			chemical mutagen			
chem_oxygen_dem			chemical oxygen demand							A measure of the capacity of water to consume oxygen during the decomposition of organic matter and the oxidation of inorganic chemicals such as ammonia and nitrite							https://microbiomedata/schema/mixs									core field												false				QuantityValue								MIXS:0000656						chemical oxygen demand			
chem_treat_method			chemical treatment method							Method of chemical administration(dose, frequency, duration, time elapsed between administration and sampling) (e.g. 50 mg/l; twice a week; 1 hr; 0 days)							https://microbiomedata/schema/mixs									core field												false				TextValue								MIXS:0000457			{float} {unit};{Rn/start_time/end_time/duration};{duration};{duration}			chemical treatment method			
chem_treatment			chemical treatment							List of chemical compounds administered upstream the sampling location where sampling occurred (e.g. Glycols, H2S scavenger, corrosion and scale inhibitors, demulsifiers, and other production chemicals etc.). The commercial name of the product and name of the supplier should be provided. The date of administration should also be included						ACCENT 1125;DOW;2010-11-17	https://microbiomedata/schema/mixs									core field												false				TextValue								MIXS:0001012			{text};{text};{timestamp}			chemical treatment			
