slot	abstract	alias	aliases	annotations	broad_mappings	close_mappings	comments	conforms_to	deprecated	description	designates_type	domain	domain_of	enum_range	exact_mappings	examples	from_schema	identifier	ifabsent	implicit_prefix	imported_from	in_language	in_subset	inlined	inlined_as_list	is_a	is_grouping_slot	is_usage_slot	key	local_names	mappings	maximum_cardinality	maximum_value	minimum_cardinality	minimum_value	mixin	mixins	multivalued	narrow_mappings 	notes	pattern	range	rank	readonly	recommended	related_mappings	required	see_also	slot_group	slot_uri	source	status	string_serialization	structured_pattern	subproperty_of	title	todos	unit	usage_slot_name
mech_struc			mechanical structure							mechanical structure: a moving structure						elevator	https://microbiomedata/schema/mixs									core field												false				mech_struc_enum								MIXS:0000815						mechanical structure			
mechanical_damage			mechanical damage							Information about any mechanical damage exerted on the plant; can include multiple damages and sites						pruning;bark	https://microbiomedata/schema/mixs									core field												true				TextValue								MIXS:0001052			{text};{text}			mechanical damage			
methane			methane							Methane (gas) amount or concentration at the time of sampling						1800 parts per billion	https://microbiomedata/schema/mixs									core field												false				QuantityValue								MIXS:0000101						methane			
micro_biomass_meth			microbial biomass method							Reference or method used in determining microbial biomass							https://microbiomedata/schema/mixs									core field												false				TextValue								MIXS:0000339			{PMID}|{DOI}|{URL}			microbial biomass method			
microbial_biomass			microbial biomass							The part of the organic matter in the soil that constitutes living microorganisms smaller than 5-10 micrometer. If you keep this, you would need to have correction factors used for conversion to the final units							https://microbiomedata/schema/mixs									core field												false				QuantityValue								MIXS:0000650						microbial biomass			
mineral_nutr_regm			mineral nutrient regimen							Information about treatment involving the use of mineral supplements; should include the name of mineral nutrient, amount administered, treatment regimen including how many times the treatment was repeated, how long each treatment lasted, and the start and end time of the entire treatment; can include multiple mineral nutrient regimens						potassium;15 gram;R2/2018-05-11T14:30/2018-05-11T19:30/P1H30M	https://microbiomedata/schema/mixs									core field												true				TextValue								MIXS:0000570			{text};{float} {unit};{Rn/start_time/end_time/duration}			mineral nutrient regimen			
misc_param			miscellaneous parameter							Any other measurement performed or parameter collected, that is not listed here						Bicarbonate ion concentration;2075 micromole per kilogram	https://microbiomedata/schema/mixs									core field												true				TextValue								MIXS:0000752			{text};{float} {unit}			miscellaneous parameter			
n_alkanes			n-alkanes							Concentration of n-alkanes; can include multiple n-alkanes						n-hexadecane;100 milligram per liter	https://microbiomedata/schema/mixs									core field												true				TextValue								MIXS:0000503			{text};{float} {unit}			n-alkanes			
nitrate			nitrate							Concentration of nitrate in the sample						65 micromole per liter	https://microbiomedata/schema/mixs									core field												false				QuantityValue								MIXS:0000425						nitrate			
nitrite			nitrite							Concentration of nitrite in the sample						0.5 micromole per liter	https://microbiomedata/schema/mixs									core field												false				QuantityValue								MIXS:0000426						nitrite			
nitro			nitrogen							Concentration of nitrogen (total)						4.2 micromole per liter	https://microbiomedata/schema/mixs									core field												false				QuantityValue								MIXS:0000504						nitrogen			
non_min_nutr_regm			non-mineral nutrient regimen							Information about treatment involving the exposure of plant to non-mineral nutrient such as oxygen, hydrogen or carbon; should include the name of non-mineral nutrient, amount administered, treatment regimen including how many times the treatment was repeated, how long each treatment lasted, and the start and end time of the entire treatment; can include multiple non-mineral nutrient regimens						carbon dioxide;10 mole per liter;R2/2018-05-11T14:30/2018-05-11T19:30/P1H30M	https://microbiomedata/schema/mixs									core field												true				TextValue								MIXS:0000571			{text};{float} {unit};{Rn/start_time/end_time/duration}			non-mineral nutrient regimen			
nucl_acid_amp			nucleic acid amplification							A link to a literature reference, electronic resource or a standard operating procedure (SOP), that describes the enzymatic amplification (PCR, TMA, NASBA) of specific nucleic acids						https://phylogenomics.me/protocols/16s-pcr-protocol/	https://microbiomedata/schema/mixs									sequencing field												false				TextValue								MIXS:0000038			{PMID}|{DOI}|{URL}			nucleic acid amplification			
nucl_acid_ext			nucleic acid extraction							A link to a literature reference, electronic resource or a standard operating procedure (SOP), that describes the material separation to recover the nucleic acid fraction from a sample						https://mobio.com/media/wysiwyg/pdfs/protocols/12888.pdf	https://microbiomedata/schema/mixs									sequencing field												false				TextValue								MIXS:0000037			{PMID}|{DOI}|{URL}			nucleic acid extraction			
number_pets			number of pets							The number of pets residing in the sampled space							https://microbiomedata/schema/mixs									core field												false				integer								MIXS:0000231						number of pets			
number_plants			number of houseplants							The number of plant(s) in the sampling space							https://microbiomedata/schema/mixs									core field												false				integer								MIXS:0000230						number of houseplants			
number_resident			number of residents							The number of individuals currently occupying in the sampling location							https://microbiomedata/schema/mixs									core field												false				integer								MIXS:0000232						number of residents			
occup_density_samp			occupant density at sampling							Average number of occupants at time of sampling per square footage							https://microbiomedata/schema/mixs									core field												false				double								MIXS:0000217						occupant density at sampling			
occup_document			occupancy documentation							The type of documentation of occupancy						estimate	https://microbiomedata/schema/mixs									core field												false				occup_document_enum								MIXS:0000816						occupancy documentation			
occup_samp			occupancy at sampling							Number of occupants present at time of sample within the given space						10	https://microbiomedata/schema/mixs									core field												false				integer								MIXS:0000772						occupancy at sampling			
org_carb			organic carbon							Concentration of organic carbon						1.5 microgram per liter	https://microbiomedata/schema/mixs									core field												false				QuantityValue								MIXS:0000508						organic carbon			
org_count_qpcr_info			organism count qPCR information							If qpcr was used for the cell count, the target gene name, the primer sequence and the cycling conditions should also be provided. (Example: 16S rrna; FWD:ACGTAGCTATGACGT REV:GTGCTAGTCGAGTAC; initial denaturation:90C_5min; denaturation:90C_2min; annealing:52C_30 sec; elongation:72C_30 sec; 90 C for 1 min; final elongation:72C_5min; 30 cycles)							https://microbiomedata/schema/mixs									core field												false				TextValue								MIXS:0000099			{text};FWD:{dna};REV:{dna};initial denaturation:degrees_minutes;denaturation:degrees_minutes;annealing:degrees_minutes;elongation:degrees_minutes;final elongation:degrees_minutes; total cycles			organism count qPCR information			
org_matter			organic matter							Concentration of organic matter						1.75 milligram per cubic meter	https://microbiomedata/schema/mixs									core field												false				QuantityValue								MIXS:0000204						organic matter			
org_nitro			organic nitrogen							Concentration of organic nitrogen						4 micromole per liter	https://microbiomedata/schema/mixs									core field												false				QuantityValue								MIXS:0000205						organic nitrogen			
org_particles			organic particles							Concentration of particles such as faeces, hairs, food, vomit, paper fibers, plant material, humus, etc.							https://microbiomedata/schema/mixs									core field												true				TextValue								MIXS:0000665			{text};{float} {unit}			organic particles			
organism_count			organism count							Total cell count of any organism (or group of organisms) per gram, volume or area of sample, should include name of organism followed by count. The method that was used for the enumeration (e.g. qPCR, atp, mpn, etc.) Should also be provided. (example: total prokaryotes; 3.5e7 cells per ml; qpcr)						total prokaryotes;3.5e7 cells per milliliter;qPCR	https://microbiomedata/schema/mixs									core field												true				organism_count_enum								MIXS:0000103						organism count			
owc_tvdss			oil water contact depth							Depth of the original oil water contact (OWC) zone (average) (m TVDSS)							https://microbiomedata/schema/mixs									core field												false				QuantityValue								MIXS:0000405						oil water contact depth			
oxy_stat_samp			oxygenation status of sample							Oxygenation status of sample						aerobic	https://microbiomedata/schema/mixs									core field												false				oxy_stat_samp_enum								MIXS:0000753						oxygenation status of sample			
oxygen			oxygen							Oxygen (gas) amount or concentration at the time of sampling						600 parts per million	https://microbiomedata/schema/mixs									core field												false				QuantityValue								MIXS:0000104						oxygen			
part_org_carb			particulate organic carbon							Concentration of particulate organic carbon						1.92 micromole per liter	https://microbiomedata/schema/mixs									core field												false				QuantityValue								MIXS:0000515						particulate organic carbon			
part_org_nitro			particulate organic nitrogen							Concentration of particulate organic nitrogen						0.3 micromole per liter	https://microbiomedata/schema/mixs									core field												false				QuantityValue								MIXS:0000719						particulate organic nitrogen			
particle_class			particle classification							Particles are classified, based on their size, into six general categories:clay, silt, sand, gravel, cobbles, and boulders; should include amount of particle preceded by the name of the particle type; can include multiple values							https://microbiomedata/schema/mixs									core field												true				TextValue								MIXS:0000206			{text};{float} {unit}			particle classification			
pcr_cond			pcr conditions							Description of reaction conditions and components of PCR in the form of 'initial denaturation:94degC_1.5min; annealing=...'						initial denaturation:94_3;annealing:50_1;elongation:72_1.5;final elongation:72_10;35	https://microbiomedata/schema/mixs									sequencing field												false				TextValue								MIXS:0000049			initial denaturation:degrees_minutes;annealing:degrees_minutes;elongation:degrees_minutes;final elongation:degrees_minutes;total cycles			pcr conditions			
pcr_primers			pcr primers							PCR primers that were used to amplify the sequence of the targeted gene, locus or subfragment. This field should contain all the primers used for a single PCR reaction if multiple forward or reverse primers are present in a single PCR reaction. The primer sequence should be reported in uppercase letters						FWD:GTGCCAGCMGCCGCGGTAA;REV:GGACTACHVGGGTWTCTAAT	https://microbiomedata/schema/mixs									sequencing field												false				TextValue								MIXS:0000046			FWD:{dna};REV:{dna}			pcr primers			
permeability			permeability							Measure of the ability of a hydrocarbon resource to allow fluids to pass through it. (Additional information: https://en.wikipedia.org/wiki/Permeability_(earth_sciences))							https://microbiomedata/schema/mixs									core field												false				TextValue								MIXS:0000404			{integer} - {integer} {unit}			permeability			
perturbation			perturbation							Type of perturbation, e.g. chemical administration, physical disturbance, etc., coupled with perturbation regimen including how many times the perturbation was repeated, how long each perturbation lasted, and the start and end time of the entire perturbation period; can include multiple perturbation types						antibiotic addition;R2/2018-05-11T14:30Z/2018-05-11T19:30Z/P1H30M	https://microbiomedata/schema/mixs									core field												true				TextValue								MIXS:0000754			{text};{Rn/start_time/end_time/duration}			perturbation			
pesticide_regm			pesticide regimen							Information about treatment involving use of insecticides; should include the name of pesticide, amount administered, treatment regimen including how many times the treatment was repeated, how long each treatment lasted, and the start and end time of the entire treatment; can include multiple pesticide regimens						pyrethrum;0.6 milligram per liter;R2/2018-05-11T14:30/2018-05-11T19:30/P1H30M	https://microbiomedata/schema/mixs									core field												true				TextValue								MIXS:0000573			{text};{float} {unit};{Rn/start_time/end_time/duration}			pesticide regimen			
petroleum_hydrocarb			petroleum hydrocarbon							Concentration of petroleum hydrocarbon						0.05 micromole per liter	https://microbiomedata/schema/mixs									core field												false				QuantityValue								MIXS:0000516						petroleum hydrocarbon			
ph			pH							Ph measurement of the sample, or liquid portion of sample, or aqueous phase of the fluid						7.2	https://microbiomedata/schema/mixs									core field												false				double								MIXS:0001001						pH			
ph_meth			pH method							Reference or method used in determining ph							https://microbiomedata/schema/mixs									core field												false				TextValue								MIXS:0001106			{PMID}|{DOI}|{URL}			pH method			
ph_regm			pH regimen							Information about treatment involving exposure of plants to varying levels of ph of the growth media, treatment regimen including how many times the treatment was repeated, how long each treatment lasted, and the start and end time of the entire treatment; can include multiple regimen						7.6;R2/2018-05-11:T14:30/2018-05-11T19:30/P1H30M	https://microbiomedata/schema/mixs									core field												true				TextValue								MIXS:0001056			{float};{Rn/start_time/end_time/duration}			pH regimen			
phaeopigments			phaeopigments							Concentration of phaeopigments; can include multiple phaeopigments						2.5 milligram per cubic meter	https://microbiomedata/schema/mixs									core field												true				TextValue								MIXS:0000180			{text};{float} {unit}			phaeopigments			
phosphate			phosphate							Concentration of phosphate						0.7 micromole per liter	https://microbiomedata/schema/mixs									core field												false				QuantityValue								MIXS:0000505						phosphate			
phosplipid_fatt_acid			phospholipid fatty acid							Concentration of phospholipid fatty acids; can include multiple values						2.98 milligram per liter	https://microbiomedata/schema/mixs									core field												true				TextValue								MIXS:0000181			{text};{float} {unit}			phospholipid fatty acid			
photon_flux			photon flux							Measurement of photon flux						3.926 micromole photons per second per square meter	https://microbiomedata/schema/mixs									core field												false				QuantityValue								MIXS:0000725						photon flux			
plant_growth_med			plant growth medium							Specification of the media for growing the plants or tissue cultured samples, e.g. soil, aeroponic, hydroponic, in vitro solid culture medium, in vitro liquid culture medium. Recommended value is a specific value from EO:plant growth medium (follow this link for terms http://purl.obolibrary.org/obo/EO_0007147) or other controlled vocabulary						hydroponic plant culture media [EO:0007067]	https://microbiomedata/schema/mixs									core field												false				plant_growth_med_enum								MIXS:0001057						plant growth medium			
plant_product			plant product							Substance produced by the plant, where the sample was obtained from						xylem sap [PO:0025539]	https://microbiomedata/schema/mixs									core field												false				TextValue								MIXS:0001058			{text}			plant product			
plant_sex			plant sex							Sex of the reproductive parts on the whole plant, e.g. pistillate, staminate, monoecieous, hermaphrodite.						Hermaphroditic	https://microbiomedata/schema/mixs									core field												false				plant_sex_enum								MIXS:0001059						plant sex			
plant_struc			plant structure							Name of plant structure the sample was obtained from; for Plant Ontology (PO) (v releases/2017-12-14) terms, see http://purl.bioontology.org/ontology/PO, e.g. petiole epidermis (PO_0000051). If an individual flower is sampled, the sex of it can be recorded here.						epidermis [PO:0005679]	https://microbiomedata/schema/mixs									core field												false				TextValue								MIXS:0001060			{termLabel} {[termID]}			plant structure			
pollutants			pollutants							Pollutant types and, amount or concentrations measured at the time of sampling; can report multiple pollutants by entering numeric values preceded by name of pollutant						lead;0.15 microgram per cubic meter	https://microbiomedata/schema/mixs									core field												true				TextValue								MIXS:0000107			{text};{float} {unit}			pollutants			
pool_dna_extracts			pooling of DNA extracts (if done)							Indicate whether multiple DNA extractions were mixed. If the answer yes, the number of extracts that were pooled should be given						yes;5	https://microbiomedata/schema/mixs									core field												false				TextValue								MIXS:0000325			{boolean};{integer}			pooling of DNA extracts (if done)			
porosity			porosity							Porosity of deposited sediment is volume of voids divided by the total volume of sample							https://microbiomedata/schema/mixs									core field												false				TextValue								MIXS:0000211			{float} - {float} {unit}			porosity			
potassium			potassium							Concentration of potassium in the sample						463 milligram per liter	https://microbiomedata/schema/mixs									core field												false				QuantityValue								MIXS:0000430						potassium			
pour_point			pour point							Temperature at which a liquid becomes semi solid and loses its flow characteristics. In crude oil a high¬†pour point¬†is generally associated with a high paraffin content, typically found in crude deriving from a larger proportion of plant material. (soure: https://en.wikipedia.org/wiki/pour_point)							https://microbiomedata/schema/mixs									core field												false				QuantityValue								MIXS:0000127						pour point			
pre_treatment			pre-treatment							The process of pre-treatment removes materials that can be easily collected from the raw wastewater							https://microbiomedata/schema/mixs									core field												false				TextValue								MIXS:0000348			{text}			pre-treatment			
pres_animal_insect			presence of pets, animals, or insects							The type and number of animals or insects present in the sampling space.						cat;5	https://microbiomedata/schema/mixs									core field												false				TextValue								MIXS:0000819						presence of pets, animals, or insects			
pressure			pressure							Pressure to which the sample is subject to, in atmospheres						50 atmosphere	https://microbiomedata/schema/mixs									core field												false				QuantityValue								MIXS:0000412						pressure			
prev_land_use_meth			history/previous land use method							Reference or method used in determining previous land use and dates							https://microbiomedata/schema/mixs									core field												false				TextValue								MIXS:0000316			{PMID}|{DOI}|{URL}			history/previous land use method			
previous_land_use			history/previous land use							Previous land use and dates							https://microbiomedata/schema/mixs									core field												false				TextValue								MIXS:0000315			{text};{timestamp}			history/previous land use			
primary_prod			primary production							Measurement of primary production, generally measured as isotope uptake						100 milligram per cubic meter per day	https://microbiomedata/schema/mixs									core field												false				QuantityValue								MIXS:0000728						primary production			
primary_treatment			primary treatment							The process to produce both a generally homogeneous liquid capable of being treated biologically and a sludge that can be separately treated or processed							https://microbiomedata/schema/mixs									core field												false				TextValue								MIXS:0000349			{text}			primary treatment			
prod_rate			production rate							Oil and/or gas production rates per well (e.g. 524 m3 / day)							https://microbiomedata/schema/mixs									core field												false				QuantityValue								MIXS:0000452						production rate			
prod_start_date			production start date							Date of field's first production						2018-05-11	https://microbiomedata/schema/mixs									core field												false				date								MIXS:0001008						production start date			
profile_position			profile position							Cross-sectional position in the hillslope where sample was collected.sample area position in relation to surrounding areas						summit	https://microbiomedata/schema/mixs									core field												false				profile_position_enum								MIXS:0001084						profile position			
quad_pos			quadrant position							The quadrant position of the sampling room within the building						West side	https://microbiomedata/schema/mixs									core field												false				quad_pos_enum								MIXS:0000820						quadrant position			
radiation_regm			radiation regimen							Information about treatment involving exposure of plant or a plant part to a particular radiation regimen; should include the radiation type, amount or intensity administered, treatment regimen including how many times the treatment was repeated, how long each treatment lasted, and the start and end time of the entire treatment; can include multiple radiation regimens						gamma radiation;60 gray;R2/2018-05-11T14:30/2018-05-11T19:30/P1H30M	https://microbiomedata/schema/mixs									core field												true				TextValue								MIXS:0000575			{text};{float} {unit};{Rn/start_time/end_time/duration}			radiation regimen			
rainfall_regm			rainfall regimen							Information about treatment involving an exposure to a given amount of rainfall, treatment regimen including how many times the treatment was repeated, how long each treatment lasted, and the start and end time of the entire treatment; can include multiple regimens						15 millimeter;R2/2018-05-11T14:30/2018-05-11T19:30/P1H30M	https://microbiomedata/schema/mixs									core field												true				TextValue								MIXS:0000576			{float} {unit};{Rn/start_time/end_time/duration}			rainfall regimen			
reactor_type			reactor type							Anaerobic digesters can be designed and engineered to operate using a number of different process configurations, as batch or continuous, mesophilic, high solid or low solid, and single stage or multistage							https://microbiomedata/schema/mixs									core field												false				TextValue								MIXS:0000350			{text}			reactor type			
redox_potential			redox potential							Redox potential, measured relative to a hydrogen cell, indicating oxidation or reduction potential						300 millivolt	https://microbiomedata/schema/mixs									core field												false				QuantityValue								MIXS:0000182						redox potential			
rel_air_humidity			relative air humidity							Partial vapor and air pressure, density of the vapor and air, or by the actual mass of the vapor and air						80%	https://microbiomedata/schema/mixs									core field												false				QuantityValue								MIXS:0000121						relative air humidity			
rel_humidity_out			outside relative humidity							The recorded outside relative humidity value at the time of sampling						12 per kilogram of air	https://microbiomedata/schema/mixs									core field												false				QuantityValue								MIXS:0000188						outside relative humidity			
rel_samp_loc			relative sampling location							The sampling location within the train car						center of car	https://microbiomedata/schema/mixs									core field												false				rel_samp_loc_enum								MIXS:0000821						relative sampling location			
rel_to_oxygen			relationship to oxygen							Is this organism an aerobe, anaerobe? Please note that aerobic and anaerobic are valid descriptors for microbial environments						aerobe	https://microbiomedata/schema/mixs									nucleic acid sequence source field												false				rel_to_oxygen_enum								MIXS:0000015						relationship to oxygen			
reservoir			reservoir name							Name of the reservoir (e.g. Carapebus)							https://microbiomedata/schema/mixs									core field												false				TextValue								MIXS:0000303			{text}			reservoir name			
