slot	abstract	alias	aliases	annotations	broad_mappings	close_mappings	comments	conforms_to	deprecated	description	designates_type	domain	domain_of	enum_range	exact_mappings	examples	from_schema	identifier	ifabsent	implicit_prefix	imported_from	in_language	in_subset	inlined	inlined_as_list	is_a	is_grouping_slot	is_usage_slot	key	local_names	mappings	maximum_cardinality	maximum_value	minimum_cardinality	minimum_value	mixin	mixins	multivalued	narrow_mappings 	notes	pattern	range	rank	readonly	recommended	related_mappings	required	see_also	slot_group	slot_uri	source	status	string_serialization	structured_pattern	subproperty_of	title	todos	unit	usage_slot_name
resins_pc			resins wt%							Saturate, Aromatic, Resin and Asphaltene¬†(SARA) is an analysis method that divides¬†crude oil¬†components according to their polarizability and polarity. There are three main methods to obtain SARA results. The most popular one is known as the Iatroscan TLC-FID and is referred to as IP-143 (source: https://en.wikipedia.org/wiki/Saturate,_aromatic,_resin_and_asphaltene)							https://microbiomedata/schema/mixs									core field												false				TextValue								MIXS:0000134			{text};{float} {unit}			resins wt%			
room_air_exch_rate			room air exchange rate							The rate at which outside air replaces indoor air in a given space							https://microbiomedata/schema/mixs									core field												false				QuantityValue								MIXS:0000169						room air exchange rate			
room_architec_elem			room architectural elements							The unique details and component parts that, together, form the architecture of a distinguisahable space within a built structure							https://microbiomedata/schema/mixs									core field												false				TextValue								MIXS:0000233			{text}			room architectural elements			
room_condt			room condition							The condition of the room at the time of sampling						new	https://microbiomedata/schema/mixs									core field												false				room_condt_enum								MIXS:0000822						room condition			
room_connected			rooms connected by a doorway							List of rooms connected to the sampling room by a doorway						office	https://microbiomedata/schema/mixs									core field												false				room_connected_enum								MIXS:0000826						rooms connected by a doorway			
room_count			room count							The total count of rooms in the built structure including all room types							https://microbiomedata/schema/mixs									core field												false				integer								MIXS:0000234						room count			
room_dim			room dimensions							The length, width and height of sampling room							https://microbiomedata/schema/mixs									core field												false				TextValue								MIXS:0000192			{integer} {unit} x {integer} {unit} x {integer} {unit}			room dimensions			
room_door_dist			room door distance							Distance between doors (meters) in the hallway between the sampling room and adjacent rooms							https://microbiomedata/schema/mixs									core field												false				TextValue								MIXS:0000193			{integer} {unit}			room door distance			
room_door_share			rooms that share a door with sampling room							List of room(s) (room number, room name) sharing a door with the sampling room							https://microbiomedata/schema/mixs									core field												false				TextValue								MIXS:0000242			{text};{integer}			rooms that share a door with sampling room			
room_hallway			rooms that are on the same hallway							List of room(s) (room number, room name) located in the same hallway as sampling room							https://microbiomedata/schema/mixs									core field												false				TextValue								MIXS:0000238			{text};{integer}			rooms that are on the same hallway			
room_loc			room location in building							The position of the room within the building						interior room	https://microbiomedata/schema/mixs									core field												false				room_loc_enum								MIXS:0000823						room location in building			
room_moist_dam_hist			room moisture damage or mold history							The history of moisture damage or mold in the past 12 months. Number of events of moisture damage or mold observed							https://microbiomedata/schema/mixs									core field												false				integer								MIXS:0000235						room moisture damage or mold history			
room_net_area			room net area							The net floor area of sampling room. Net area excludes wall thicknesses							https://microbiomedata/schema/mixs									core field												false				TextValue								MIXS:0000194			{integer} {unit}			room net area			
room_occup			room occupancy							Count of room occupancy at time of sampling							https://microbiomedata/schema/mixs									core field												false				integer								MIXS:0000236						room occupancy			
room_samp_pos			room sampling position							The horizontal sampling position in the room relative to architectural elements						south corner	https://microbiomedata/schema/mixs									core field												false				room_samp_pos_enum								MIXS:0000824						room sampling position			
room_type			room type							The main purpose or activity of the sampling room. A room is any distinguishable space within a structure						bathroom	https://microbiomedata/schema/mixs									core field												false				room_type_enum								MIXS:0000825						room type			
room_vol			room volume							Volume of sampling room							https://microbiomedata/schema/mixs									core field												false				TextValue								MIXS:0000195			{integer} {unit}			room volume			
room_wall_share			rooms that share a wall with sampling room							List of room(s) (room number, room name) sharing a wall with the sampling room							https://microbiomedata/schema/mixs									core field												false				TextValue								MIXS:0000243			{text};{integer}			rooms that share a wall with sampling room			
room_window_count			room window count							Number of windows in the room							https://microbiomedata/schema/mixs									core field												false				integer								MIXS:0000237						room window count			
root_cond			rooting conditions							Relevant rooting conditions such as field plot size, sowing density, container dimensions, number of plants per container.						http://himedialabs.com/TD/PT158.pdf	https://microbiomedata/schema/mixs									core field												false				TextValue								MIXS:0001061			{PMID}|{DOI}|{URL}|{text}			rooting conditions			
root_med_carbon			rooting medium carbon							Source of organic carbon in the culture rooting medium; e.g. sucrose.						sucrose	https://microbiomedata/schema/mixs									core field												false				TextValue								MIXS:0000577			{text};{float} {unit}			rooting medium carbon			
root_med_macronutr			rooting medium macronutrients							Measurement of the culture rooting medium macronutrients (N,P, K, Ca, Mg, S); e.g. KH2PO4 (170¬†mg/L).						KH2PO4;170¬†milligram per liter	https://microbiomedata/schema/mixs									core field												false				TextValue								MIXS:0000578			{text};{float} {unit}			rooting medium macronutrients			
root_med_micronutr			rooting medium micronutrients							Measurement of the culture rooting medium micronutrients (Fe, Mn, Zn, B, Cu, Mo); e.g. H3BO3 (6.2¬†mg/L).						H3BO3;6.2¬†milligram per liter	https://microbiomedata/schema/mixs									core field												false				TextValue								MIXS:0000579			{text};{float} {unit}			rooting medium micronutrients			
root_med_ph			rooting medium pH							pH measurement of the culture rooting medium; e.g. 5.5.						7.5	https://microbiomedata/schema/mixs									core field												false				double								MIXS:0001062						rooting medium pH			
root_med_regl			rooting medium regulators							Growth regulators in the culture rooting medium such as cytokinins, auxins, gybberellins, abscisic acid; e.g. 0.5¬†mg/L NAA.						abscisic acid;0.75 milligram per liter	https://microbiomedata/schema/mixs									core field												false				TextValue								MIXS:0000581			{text};{float} {unit}			rooting medium regulators			
root_med_solid			rooting medium solidifier							Specification of the solidifying agent in the culture rooting medium; e.g. agar.						agar	https://microbiomedata/schema/mixs									core field												false				TextValue								MIXS:0001063			{text}			rooting medium solidifier			
root_med_suppl			rooting medium organic supplements							Organic supplements of the culture rooting medium, such as vitamins, amino acids, organic acids, antibiotics activated charcoal; e.g. nicotinic acid (0.5¬†mg/L).						nicotinic acid;0.5 milligram per liter	https://microbiomedata/schema/mixs									core field												false				TextValue								MIXS:0000580			{text};{float} {unit}			rooting medium organic supplements			
salinity			salinity							The total concentration of all dissolved salts in a liquid or solid sample. While salinity can be measured by a complete chemical analysis, this method is difficult and time consuming. More often, it is instead derived from the conductivity measurement. This is known as practical salinity. These derivations compare the specific conductance of the sample to a salinity standard such as seawater.						25 practical salinity unit	https://microbiomedata/schema/mixs									core field												false				QuantityValue								MIXS:0000183						salinity			
salinity_meth			salinity method							Reference or method used in determining salinity							https://microbiomedata/schema/mixs									core field												false				TextValue								MIXS:0000341			{PMID}|{DOI}|{URL}			salinity method			
salt_regm			salt regimen							Information about treatment involving use of salts as supplement to liquid and soil growth media; should include the name of salt, amount administered, treatment regimen including how many times the treatment was repeated, how long each treatment lasted, and the start and end time of the entire treatment; can include multiple salt regimens						NaCl;5 gram per liter;R2/2018-05-11T14:30/2018-05-11T19:30/P1H30M	https://microbiomedata/schema/mixs									core field												true				TextValue								MIXS:0000582			{text};{float} {unit};{Rn/start_time/end_time/duration}			salt regimen			
samp_capt_status			sample capture status							Reason for the sample						farm sample	https://microbiomedata/schema/mixs									core field												false				samp_capt_status_enum								MIXS:0000860						sample capture status			
samp_collec_device			sample collection device							The device used to collect an environmental sample. This field accepts terms listed under environmental sampling device (http://purl.obolibrary.org/obo/ENVO). This field also accepts terms listed under specimen collection device (http://purl.obolibrary.org/obo/GENEPIO_0002094).						swab, biopsy, niskin bottle, push core, drag swab [GENEPIO:0002713]	https://microbiomedata/schema/mixs									nucleic acid sequence source field												false				TextValue								MIXS:0000002			{termLabel} {[termID]}|{text}			sample collection device			
samp_collec_method			sample collection method							The method employed for collecting the sample.						swabbing	https://microbiomedata/schema/mixs									nucleic acid sequence source field												false				TextValue								MIXS:0001225			{PMID}|{DOI}|{URL}|{text}			sample collection method			
samp_collect_point			sample collection point							"Sampling point on the asset were sample was collected (e.g. Wellhead, storage tank, separator, etc). If ""other"" is specified, please propose entry in ""additional info"" field"						well	https://microbiomedata/schema/mixs									core field												false				samp_collect_point_enum								MIXS:0001015						sample collection point			
samp_dis_stage			sample disease stage							Stage of the disease at the time of sample collection, e.g. inoculation, penetration, infection, growth and reproduction, dissemination of pathogen.						infection	https://microbiomedata/schema/mixs									core field												false				samp_dis_stage_enum								MIXS:0000249						sample disease stage			
samp_floor			sampling floor							The floor of the building, where the sampling room is located						4th floor	https://microbiomedata/schema/mixs									core field												false				samp_floor_enum								MIXS:0000828						sampling floor			
samp_loc_corr_rate			corrosion rate at sample location							Metal corrosion rate is the speed of metal deterioration due to environmental conditions. As environmental conditions change corrosion rates change accordingly. Therefore, long term corrosion rates are generally more informative than short term rates and for that reason they are preferred during reporting. In the case of suspected MIC, corrosion rate measurements at the time of sampling might provide insights into the involvement of certain microbial community members in MIC as well as potential microbial interplays							https://microbiomedata/schema/mixs									core field												false				TextValue								MIXS:0000136			{float} - {float} {unit}			corrosion rate at sample location			
samp_mat_process			sample material processing							A brief description of any processing applied to the sample during or after retrieving the sample from environment, or a link to the relevant protocol(s) performed.						filtering of seawater, storing samples in ethanol	https://microbiomedata/schema/mixs									nucleic acid sequence source field												false				TextValue								MIXS:0000016			{text}			sample material processing			
samp_md			sample measured depth							"In non deviated well, measured depth is equal to the true vertical depth, TVD (TVD=TVDSS plus the reference or datum it refers to). In deviated wells, the MD is the length of trajectory of the borehole measured from the same reference or datum. Common datums used are ground level (GL), drilling rig floor (DF), rotary table (RT), kelly bushing (KB) and mean sea level (MSL). If ""other"" is specified, please propose entry in ""additional info"" field"						1534 meter;MSL	https://microbiomedata/schema/mixs									core field												false				samp_md_enum								MIXS:0000413						sample measured depth			
samp_name			sample name							A local identifier or name that for the material sample used for extracting nucleic acids, and subsequent sequencing. It can refer either to the original material collected or to any derived sub-samples. It can have any format, but we suggest that you make it concise, unique and consistent within your lab, and as informative as possible. INSDC requires every sample name from a single Submitter to be unique. Use of a globally unique identifier for the field source_mat_id is recommended in addition to sample_name.						ISDsoil1	https://microbiomedata/schema/mixs									investigation field												false				TextValue								MIXS:0001107			{text}			sample name			
samp_preserv			preservative added to sample							Preservative added to the sample (e.g. Rnalater, alcohol, formaldehyde, etc.). Where appropriate include volume added (e.g. Rnalater; 2 ml)							https://microbiomedata/schema/mixs									core field												false				TextValue								MIXS:0000463			{text};{float} {unit}			preservative added to sample			
samp_room_id			sampling room ID or name							Sampling room number. This ID should be consistent with the designations on the building floor plans							https://microbiomedata/schema/mixs									core field												false				integer								MIXS:0000244						sampling room ID or name			
samp_size			amount or size of sample collected							The total amount or size (volume (ml), mass (g) or area (m2) ) of sample collected.						5 liter	https://microbiomedata/schema/mixs									nucleic acid sequence source field												false				QuantityValue								MIXS:0000001						amount or size of sample collected			
samp_sort_meth			sample size sorting method							Method by which samples are sorted; open face filter collecting total suspended particles, prefilter to remove particles larger than X micrometers in diameter, where common values of X would be 10 and 2.5 full size sorting in a cascade impactor.							https://microbiomedata/schema/mixs									core field												true				TextValue								MIXS:0000216			{text}			sample size sorting method			
samp_store_dur			sample storage duration							Duration for which the sample was stored						P1Y6M	https://microbiomedata/schema/mixs									core field												false				TextValue								MIXS:0000116			{duration}			sample storage duration			
samp_store_loc			sample storage location							Location at which sample was stored, usually name of a specific freezer/room						Freezer no:5	https://microbiomedata/schema/mixs									core field												false				TextValue								MIXS:0000755			{text}			sample storage location			
samp_store_temp			sample storage temperature							Temperature at which sample was stored, e.g. -80 degree Celsius						-80 degree Celsius	https://microbiomedata/schema/mixs									core field												false				QuantityValue								MIXS:0000110						sample storage temperature			
samp_subtype			sample subtype							"Name of sample sub-type. For example if ""sample type"" is ""Produced Water"" then subtype could be ""Oil Phase"" or ""Water Phase"". If ""other"" is specified, please propose entry in ""additional info"" field"						biofilm	https://microbiomedata/schema/mixs									core field												false				samp_subtype_enum								MIXS:0000999						sample subtype			
samp_taxon_id			Taxonomy ID of DNA sample							NCBI taxon id of the sample.  Maybe be a single taxon or mixed taxa sample. Use 'synthetic metagenome’ for mock community/positive controls, or 'blank sample' for negative controls.						Gut Metagenome [NCBI:txid749906]	https://microbiomedata/schema/mixs									investigation field												false				TextValue								MIXS:0001320			{text} [NCBI:txid]			Taxonomy ID of DNA sample			
samp_time_out			sampling time outside							The recent and long term history of outside sampling							https://microbiomedata/schema/mixs									core field												false				double								MIXS:0000196						sampling time outside			
samp_transport_cond			sample transport conditions							Sample transport duration (in days or hrs) and temperature the sample was exposed to (e.g. 5.5 days; 20 ¬∞C)						5 days;-20 degree Celsius	https://microbiomedata/schema/mixs									core field												false				TextValue								MIXS:0000410			{float} {unit};{float} {unit}			sample transport conditions			
samp_tvdss			sample true vertical depth subsea							Depth of the sample i.e. The vertical distance between the sea level and the sampled position in the subsurface. Depth can be reported as an interval for subsurface samples e.g. 1325.75-1362.25 m							https://microbiomedata/schema/mixs									core field												false				TextValue								MIXS:0000409			{float}-{float} {unit}			sample true vertical depth subsea			
samp_type			sample type							The type of material from which the sample was obtained. For the Hydrocarbon package, samples include types like core, rock trimmings, drill cuttings, piping section, coupon, pigging debris, solid deposit, produced fluid, produced water, injected water, swabs, etc. For the Food Package, samples are usually categorized as food, body products or tissues, or environmental material. This field accepts terms listed under environmental specimen (http://purl.obolibrary.org/obo/GENEPIO_0001246).						built environment sample [GENEPIO:0001248]	https://microbiomedata/schema/mixs									core field												false				TextValue								MIXS:0000998			{termLabel} {[termID]}			sample type			
samp_vol_we_dna_ext			sample volume or weight for DNA extraction							Volume (ml) or mass (g) of total collected sample processed for DNA extraction. Note: total sample collected should be entered under the term Sample Size (MIXS:0000001).						1500 milliliter	https://microbiomedata/schema/mixs									nucleic acid sequence source field												false				QuantityValue								MIXS:0000111						sample volume or weight for DNA extraction			
samp_weather			sampling day weather							The weather on the sampling day						foggy	https://microbiomedata/schema/mixs									core field												false				samp_weather_enum								MIXS:0000827						sampling day weather			
samp_well_name			sample well name							Name of the well (e.g. BXA1123) where sample was taken							https://microbiomedata/schema/mixs									core field												false				TextValue								MIXS:0000296			{text}			sample well name			
saturates_pc			saturates wt%							Saturate, Aromatic, Resin and Asphaltene¬†(SARA) is an analysis method that divides¬†crude oil¬†components according to their polarizability and polarity. There are three main methods to obtain SARA results. The most popular one is known as the Iatroscan TLC-FID and is referred to as IP-143 (source: https://en.wikipedia.org/wiki/Saturate,_aromatic,_resin_and_asphaltene)							https://microbiomedata/schema/mixs									core field												false				TextValue								MIXS:0000131			{text};{float} {unit}			saturates wt%			
season			season							The season when sampling occurred. Any of the four periods into which the year is divided by the equinoxes and solstices. This field accepts terms listed under season (http://purl.obolibrary.org/obo/NCIT_C94729).						autumn [NCIT:C94733]	https://microbiomedata/schema/mixs									core field												false				TextValue								MIXS:0000829			{termLabel} {[termID]}			season			
season_environment			seasonal environment							Treatment involving an exposure to a particular season (e.g. Winter, summer, rabi, rainy etc.), treatment regimen including how many times the treatment was repeated, how long each treatment lasted, and the start and end time of the entire treatment						rainy;R2/2018-05-11T14:30/2018-05-11T19:30/P1H30M	https://microbiomedata/schema/mixs									core field												true				TextValue								MIXS:0001068			{text};{Rn/start_time/end_time/duration}			seasonal environment			
season_precpt			mean seasonal precipitation							The average of all seasonal precipitation values known, or an estimated equivalent value derived by such methods as regional indexes or Isohyetal maps.							https://microbiomedata/schema/mixs									core field												false				QuantityValue								MIXS:0000645						mean seasonal precipitation			
season_temp			mean seasonal temperature							Mean seasonal temperature						18 degree Celsius	https://microbiomedata/schema/mixs									core field												false				QuantityValue								MIXS:0000643						mean seasonal temperature			
season_use			seasonal use							The seasons the space is occupied						Winter	https://microbiomedata/schema/mixs									core field												false				season_use_enum								MIXS:0000830						seasonal use			
secondary_treatment			secondary treatment							The process for substantially degrading the biological content of the sewage							https://microbiomedata/schema/mixs									core field												false				TextValue								MIXS:0000351			{text}			secondary treatment			
sediment_type			sediment type							Information about the sediment type based on major constituents						biogenous	https://microbiomedata/schema/mixs									core field												false				sediment_type_enum								MIXS:0001078						sediment type			
seq_meth			sequencing method							Sequencing machine used. Where possible the term should be taken from the OBI list of DNA sequencers (http://purl.obolibrary.org/obo/OBI_0400103).						454 Genome Sequencer FLX [OBI:0000702]	https://microbiomedata/schema/mixs									sequencing field												false				TextValue								MIXS:0000050			{termLabel} {[termID]}|{text}			sequencing method			
seq_quality_check			sequence quality check							Indicate if the sequence has been called by automatic systems (none) or undergone a manual editing procedure (e.g. by inspecting the raw data or chromatograms). Applied only for sequences that are not submitted to SRA,ENA or DRA						none	https://microbiomedata/schema/mixs									sequencing field												false				TextValue								MIXS:0000051			[none|manually edited]			sequence quality check			
sewage_type			sewage type							Type of wastewater treatment plant as municipial or industrial							https://microbiomedata/schema/mixs									core field												false				TextValue								MIXS:0000215			{text}			sewage type			
shad_dev_water_mold			shading device signs of water/mold							Signs of the presence of mold or mildew on the shading device						no presence of mold visible	https://microbiomedata/schema/mixs									core field												false				TextValue								MIXS:0000834			[presence of mold visible|no presence of mold visible]			shading device signs of water/mold			
shading_device_cond			shading device condition							The physical condition of the shading device at the time of sampling						new	https://microbiomedata/schema/mixs									core field												false				shading_device_cond_enum								MIXS:0000831						shading device condition			
shading_device_loc			shading device location							The location of the shading device in relation to the built structure						exterior	https://microbiomedata/schema/mixs									core field												false				TextValue								MIXS:0000832			[exterior|interior]			shading device location			
shading_device_mat			shading device material							The material the shading device is composed of							https://microbiomedata/schema/mixs									core field												false				TextValue								MIXS:0000245			{text}			shading device material			
shading_device_type			shading device type							The type of shading device						slatted aluminum awning	https://microbiomedata/schema/mixs									core field												false				shading_device_type_enum								MIXS:0000835						shading device type			
