slot	abstract	alias	aliases	annotations	broad_mappings	close_mappings	comments	conforms_to	deprecated	description	designates_type	domain	domain_of	enum_range	exact_mappings	examples	from_schema	identifier	ifabsent	implicit_prefix	imported_from	in_language	in_subset	inlined	inlined_as_list	is_a	is_grouping_slot	is_usage_slot	key	local_names	mappings	maximum_cardinality	maximum_value	minimum_cardinality	minimum_value	mixin	mixins	multivalued	narrow_mappings 	notes	pattern	range	rank	readonly	recommended	related_mappings	required	see_also	slot_group	slot_uri	source	status	string_serialization	structured_pattern	subproperty_of	title	todos	unit	usage_slot_name
gaseous_substances			gaseous substances							Amount or concentration of substances such as hydrogen sulfide, carbon dioxide, methane, etc.; can include multiple substances							https://microbiomedata/schema/mixs									core field												true				TextValue								MIXS:0000661			{text};{float} {unit}			gaseous substances			
gender_restroom			gender of restroom							The gender type of the restroom						male	https://microbiomedata/schema/mixs									core field												false				gender_restroom_enum								MIXS:0000808						gender of restroom			
genetic_mod			genetic modification							Genetic modifications of the genome of an organism, which may occur naturally by spontaneous mutation, or be introduced by some experimental means, e.g. specification of a transgene or the gene knocked-out or details of transient transfection						aox1A transgenic	https://microbiomedata/schema/mixs									core field												false				TextValue								MIXS:0000859			{PMID}|{DOI}|{URL}|{text}			genetic modification			
geo_loc_name			geographic location (country and/or sea,region)							The geographical origin of the sample as defined by the country or sea name followed by specific region name. Country or sea names should be chosen from the INSDC country list (http://insdc.org/country.html), or the GAZ ontology (http://purl.bioontology.org/ontology/GAZ)						USA: Maryland, Bethesda	https://microbiomedata/schema/mixs									environment field												false				TextValue								MIXS:0000010			{term}: {term}, {text}			geographic location (country and/or sea,region)			
glucosidase_act			glucosidase activity							Measurement of glucosidase activity						5 mol per liter per hour	https://microbiomedata/schema/mixs									core field												false				QuantityValue								MIXS:0000137						glucosidase activity			
gravidity			gravidity							Whether or not subject is gravid, and if yes date due or date post-conception, specifying which is used						yes;due date:2018-05-11	https://microbiomedata/schema/mixs									core field												false				TextValue								MIXS:0000875			{boolean};{timestamp}			gravidity			
gravity			gravity							Information about treatment involving use of gravity factor to study various types of responses in presence, absence or modified levels of gravity; treatment regimen including how many times the treatment was repeated, how long each treatment lasted, and the start and end time of the entire treatment; can include multiple treatments						12 g;R2/2018-05-11T14:30/2018-05-11T19:30/P1H30M	https://microbiomedata/schema/mixs									core field												true				TextValue								MIXS:0000559			{float} {unit};{Rn/start_time/end_time/duration}			gravity			
growth_facil			growth facility							Type of facility where the sampled plant was grown; controlled vocabulary: growth chamber, open top chamber, glasshouse, experimental garden, field. Alternatively use Crop Ontology (CO) terms, see http://www.cropontology.org/ontology/CO_715/Crop%20Research						Growth chamber [CO_715:0000189]	https://microbiomedata/schema/mixs									core field												false				TextValue								MIXS:0001043			{text}|{termLabel} {[termID]}			growth facility			
growth_habit			growth habit							Characteristic shape, appearance or growth form of a plant species						spreading	https://microbiomedata/schema/mixs									core field												false				growth_habit_enum								MIXS:0001044						growth habit			
growth_hormone_regm			growth hormone regimen							Information about treatment involving use of growth hormones; should include the name of growth hormone, amount administered, treatment regimen including how many times the treatment was repeated, how long each treatment lasted, and the start and end time of the entire treatment; can include multiple growth hormone regimens						abscisic acid;0.5 milligram per liter;R2/2018-05-11T14:30/2018-05-11T19:30/P1H30M	https://microbiomedata/schema/mixs									core field												true				TextValue								MIXS:0000560			{text};{float} {unit};{Rn/start_time/end_time/duration}			growth hormone regimen			
hall_count			hallway/corridor count							The total count of hallways and cooridors in the built structure							https://microbiomedata/schema/mixs									core field												false				integer								MIXS:0000228						hallway/corridor count			
handidness			handidness							The handidness of the individual sampled						right handedness	https://microbiomedata/schema/mixs									core field												false				handidness_enum								MIXS:0000809						handidness			
hc_produced			hydrocarbon type produced							"Main hydrocarbon type produced from resource (i.e. Oil, gas, condensate, etc). If ""other"" is specified, please propose entry in ""additional info"" field"						Gas	https://microbiomedata/schema/mixs									core field												false				hc_produced_enum								MIXS:0000989						hydrocarbon type produced			
hcr			hydrocarbon resource type							"Main Hydrocarbon Resource type. The term ""Hydrocarbon Resource"" HCR defined as a natural environmental feature containing large amounts of hydrocarbons at high concentrations potentially suitable for commercial exploitation. This term should not be confused with the Hydrocarbon Occurrence term which also includes hydrocarbon-rich environments with currently limited commercial interest such as seeps, outcrops, gas hydrates etc. If ""other"" is specified, please propose entry in ""additional info"" field"						Oil Sand	https://microbiomedata/schema/mixs									core field												false				hcr_enum								MIXS:0000988						hydrocarbon resource type			
hcr_fw_salinity			formation water salinity							Original formation water salinity (prior to secondary recovery e.g. Waterflooding) expressed as TDS							https://microbiomedata/schema/mixs									core field												false				QuantityValue								MIXS:0000406						formation water salinity			
hcr_geol_age			hydrocarbon resource geological age							"Geological age of hydrocarbon resource (Additional info: https://en.wikipedia.org/wiki/Period_(geology)). If ""other"" is specified, please propose entry in ""additional info"" field"						Silurian	https://microbiomedata/schema/mixs									core field												false				hcr_geol_age_enum								MIXS:0000993						hydrocarbon resource geological age			
hcr_pressure			hydrocarbon resource original pressure							Original pressure of the hydrocarbon resource							https://microbiomedata/schema/mixs									core field												false				TextValue								MIXS:0000395			{float} - {float} {unit}			hydrocarbon resource original pressure			
hcr_temp			hydrocarbon resource original temperature							Original temperature of the hydrocarbon resource						150-295 degree Celsius	https://microbiomedata/schema/mixs									core field												false				TextValue								MIXS:0000393			{float} - {float} {unit}			hydrocarbon resource original temperature			
heat_cool_type			heating and cooling system type							Methods of conditioning or heating a room or building						heat pump	https://microbiomedata/schema/mixs									core field												true				heat_cool_type_enum								MIXS:0000766						heating and cooling system type			
heat_deliv_loc			heating delivery locations							The location of heat delivery within the room						north	https://microbiomedata/schema/mixs									core field												false				heat_deliv_loc_enum								MIXS:0000810						heating delivery locations			
heat_sys_deliv_meth			heating system delivery method							The method by which the heat is delivered through the system						radiant	https://microbiomedata/schema/mixs									core field												false				TextValue								MIXS:0000812			[conductive|radiant]			heating system delivery method			
heat_system_id			heating system identifier							The heating system identifier							https://microbiomedata/schema/mixs									core field												false				integer								MIXS:0000833						heating system identifier			
heavy_metals			extreme_unusual_properties/heavy metals							Heavy metals present in the sequenced sample and their concentrations. For multiple heavy metals and concentrations, add multiple copies of this field.						mercury;0.09 micrograms per gram	https://microbiomedata/schema/mixs									core field												true				TextValue								MIXS:0000652			{text};{float} {unit}			extreme_unusual_properties/heavy metals			
heavy_metals_meth			extreme_unusual_properties/heavy metals method							Reference or method used in determining heavy metals							https://microbiomedata/schema/mixs									core field												false				TextValue								MIXS:0000343			{PMID}|{DOI}|{URL}			extreme_unusual_properties/heavy metals method			
height_carper_fiber			height carpet fiber mat							The average carpet fiber height in the indoor environment							https://microbiomedata/schema/mixs									core field												false				QuantityValue								MIXS:0000167						height carpet fiber mat			
herbicide_regm			herbicide regimen							Information about treatment involving use of herbicides; information about treatment involving use of growth hormones; should include the name of herbicide, amount administered, treatment regimen including how many times the treatment was repeated, how long each treatment lasted, and the start and end time of the entire treatment; can include multiple regimens						atrazine;10 milligram per liter;R2/2018-05-11T14:30/2018-05-11T19:30/P1H30M	https://microbiomedata/schema/mixs									core field												true				TextValue								MIXS:0000561			{text};{float} {unit};{Rn/start_time/end_time/duration}			herbicide regimen			
horizon_meth			soil horizon method							Reference or method used in determining the horizon							https://microbiomedata/schema/mixs									core field												false				TextValue								MIXS:0000321			{PMID}|{DOI}|{URL}			soil horizon method			
host_age			host age							Age of host at the time of sampling; relevant scale depends on species and study, e.g. Could be seconds for amoebae or centuries for trees						10 days	https://microbiomedata/schema/mixs									core field												false				QuantityValue								MIXS:0000255						host age			
host_body_habitat			host body habitat							Original body habitat where the sample was obtained from						nasopharynx	https://microbiomedata/schema/mixs									core field												false				TextValue								MIXS:0000866			{text}			host body habitat			
host_body_product			host body product							Substance produced by the body, e.g. Stool, mucus, where the sample was obtained from. For foundational model of anatomy ontology (fma) or Uber-anatomy ontology (UBERON) terms, please see https://www.ebi.ac.uk/ols/ontologies/fma or https://www.ebi.ac.uk/ols/ontologies/uberon						Portion of mucus [fma66938]	https://microbiomedata/schema/mixs									core field												false				TextValue								MIXS:0000888			{termLabel} {[termID]}			host body product			
host_body_site			host body site							Name of body site where the sample was obtained from, such as a specific organ or tissue (tongue, lung etc...). For foundational model of anatomy ontology (fma) (v 4.11.0) or Uber-anatomy ontology (UBERON) (v releases/2014-06-15) terms, please see http://purl.bioontology.org/ontology/FMA or http://purl.bioontology.org/ontology/UBERON						gill [UBERON:0002535]	https://microbiomedata/schema/mixs									core field												false				TextValue								MIXS:0000867			{termLabel} {[termID]}			host body site			
host_body_temp			host body temperature							Core body temperature of the host when sample was collected						15 degree Celsius	https://microbiomedata/schema/mixs									core field												false				QuantityValue								MIXS:0000274						host body temperature			
host_color			host color							The color of host							https://microbiomedata/schema/mixs									core field												false				TextValue								MIXS:0000260			{text}			host color			
host_common_name			host common name							Common name of the host.						human	https://microbiomedata/schema/mixs									core field												false				TextValue								MIXS:0000248			{text}			host common name			
host_diet			host diet							Type of diet depending on the host, for animals omnivore, herbivore etc., for humans high-fat, meditteranean etc.; can include multiple diet types						herbivore	https://microbiomedata/schema/mixs									core field												true				TextValue								MIXS:0000869			{text}			host diet			
host_dry_mass			host dry mass							Measurement of dry mass						500 gram	https://microbiomedata/schema/mixs									core field												false				QuantityValue								MIXS:0000257						host dry mass			
host_family_relation			host family relationship							Familial relationships to other hosts in the same study; can include multiple relationships						offspring;Mussel25	https://microbiomedata/schema/mixs									core field												true				TextValue								MIXS:0000872			{text};{text}			host family relationship			
host_genotype			host genotype							Observed genotype						C57BL/6	https://microbiomedata/schema/mixs									core field												false				TextValue								MIXS:0000365			{text}			host genotype			
host_growth_cond			host growth conditions							Literature reference giving growth conditions of the host						https://academic.oup.com/icesjms/article/68/2/349/617247	https://microbiomedata/schema/mixs									core field												false				TextValue								MIXS:0000871			{PMID}|{DOI}|{URL}|{text}			host growth conditions			
host_height			host height							The height of subject						0.1 meter	https://microbiomedata/schema/mixs									core field												false				QuantityValue								MIXS:0000264						host height			
host_last_meal			host last meal							Content of last meal and time since feeding; can include multiple values						corn feed;P2H	https://microbiomedata/schema/mixs									core field												true				TextValue								MIXS:0000870			{text};{duration}			host last meal			
host_length			host length							The length of subject						1 meter	https://microbiomedata/schema/mixs									core field												false				QuantityValue								MIXS:0000256						host length			
host_life_stage			host life stage							Description of life stage of host						adult	https://microbiomedata/schema/mixs									core field												false				TextValue								MIXS:0000251			{text}			host life stage			
host_phenotype			host phenotype							Phenotype of human or other host. For phenotypic quality ontology (pato) (v 2018-03-27) terms, please see http://purl.bioontology.org/ontology/pato. For Human Phenotype Ontology (HP) (v 2018-06-13) please see http://purl.bioontology.org/ontology/HP						elongated [PATO:0001154]	https://microbiomedata/schema/mixs									core field												false				TextValue								MIXS:0000874			{termLabel} {[termID]}			host phenotype			
host_sex			host sex							Gender or physical sex of the host.						non-binary	https://microbiomedata/schema/mixs									core field												false				host_sex_enum								MIXS:0000811						host sex			
host_shape			host shape							Morphological shape of host						round	https://microbiomedata/schema/mixs									core field												false				TextValue								MIXS:0000261			{text}			host shape			
host_subject_id			host subject id							A unique identifier by which each subject can be referred to, de-identified.						MPI123	https://microbiomedata/schema/mixs									core field												false				TextValue								MIXS:0000861			{text}			host subject id			
host_subspecf_genlin			host subspecific genetic lineage							Information about the genetic distinctness of the host organism below the subspecies level e.g., serovar, serotype, biotype, ecotype, variety, cultivar, or any relevant genetic typing schemes like Group I plasmid. Subspecies should not be recorded in this term, but in the NCBI taxonomy. Supply both the lineage name and the lineage rank separated by a colon, e.g., biovar:abc123.						serovar:Newport, variety:glabrum, cultivar: Red Delicious	https://microbiomedata/schema/mixs									core field												true				TextValue								MIXS:0001318			{rank name}:{text}			host subspecific genetic lineage			
host_substrate			host substrate							The growth substrate of the host.						rock	https://microbiomedata/schema/mixs									core field												false				TextValue								MIXS:0000252			{text}			host substrate			
host_symbiont			observed host symbionts							The taxonomic name of the organism(s) found living in mutualistic, commensalistic, or parasitic symbiosis with the specific host.						flukeworms	https://microbiomedata/schema/mixs									core field												true				TextValue								MIXS:0001298			{text}			observed host symbionts			
host_taxid			host taxid							NCBI taxon id of the host, e.g. 9606						7955	https://microbiomedata/schema/mixs									core field												false				TextValue								MIXS:0000250			{NCBI taxid}			host taxid			
host_tot_mass			host total mass							Total mass of the host at collection, the unit depends on host						2500 gram	https://microbiomedata/schema/mixs									core field												false				QuantityValue								MIXS:0000263						host total mass			
host_wet_mass			host wet mass							Measurement of wet mass						1500 gram	https://microbiomedata/schema/mixs									core field												false				QuantityValue								MIXS:0000567						host wet mass			
humidity			humidity							Amount of water vapour in the air, at the time of sampling						25 gram per cubic meter	https://microbiomedata/schema/mixs									core field												false				QuantityValue								MIXS:0000100						humidity			
humidity_regm			humidity regimen							Information about treatment involving an exposure to varying degree of humidity; information about treatment involving use of growth hormones; should include amount of humidity administered, treatment regimen including how many times the treatment was repeated, how long each treatment lasted, and the start and end time of the entire treatment; can include multiple regimens						25 gram per cubic meter;R2/2018-05-11T14:30/2018-05-11T19:30/P1H30M	https://microbiomedata/schema/mixs									core field												true				TextValue								MIXS:0000568			{float} {unit};{Rn/start_time/end_time/duration}			humidity regimen			
indoor_space			indoor space							A distinguishable space within a structure, the purpose for which discrete areas of a building is used						foyer	https://microbiomedata/schema/mixs									core field												false				indoor_space_enum								MIXS:0000763						indoor space			
indoor_surf			indoor surface							Type of indoor surface						wall	https://microbiomedata/schema/mixs									core field												false				indoor_surf_enum								MIXS:0000764						indoor surface			
indust_eff_percent			industrial effluent percent							Percentage of industrial effluents received by wastewater treatment plant							https://microbiomedata/schema/mixs									core field												false				QuantityValue								MIXS:0000662						industrial effluent percent			
inorg_particles			inorganic particles							Concentration of particles such as sand, grit, metal particles, ceramics, etc.; can include multiple particles							https://microbiomedata/schema/mixs									core field												true				TextValue								MIXS:0000664			{text};{float} {unit}			inorganic particles			
inside_lux			inside lux light							The recorded value at sampling time (power density)							https://microbiomedata/schema/mixs									core field												false				QuantityValue								MIXS:0000168						inside lux light			
int_wall_cond			interior wall condition							The physical condition of the wall at the time of sampling; photos or video preferred; use drawings to indicate location of damaged areas						damaged	https://microbiomedata/schema/mixs									core field												false				int_wall_cond_enum								MIXS:0000813						interior wall condition			
iw_bt_date_well			injection water breakthrough date of specific well							Injection water breakthrough date per well following a secondary and/or tertiary recovery						2018-05-11	https://microbiomedata/schema/mixs									core field												false				date								MIXS:0001010						injection water breakthrough date of specific well			
iwf			injection water fraction							Proportion of the produced fluids derived from injected water at the time of sampling. (e.g. 87%)							https://microbiomedata/schema/mixs									core field												false				QuantityValue								MIXS:0000455						injection water fraction			
last_clean			last time swept/mopped/vacuumed							The last time the floor was cleaned (swept, mopped, vacuumed)						2018-05-11:T14:30Z	https://microbiomedata/schema/mixs									core field												false				date								MIXS:0000814						last time swept/mopped/vacuumed			
lat_lon			geographic location (latitude and longitude)							The geographical origin of the sample as defined by latitude and longitude. The values should be reported in decimal degrees and in WGS84 system						50.586825 6.408977	https://microbiomedata/schema/mixs									environment field												false				TextValue								MIXS:0000009			{float} {float}			geographic location (latitude and longitude)			
light_intensity			light intensity							Measurement of light intensity						0.3 lux	https://microbiomedata/schema/mixs									core field												false				QuantityValue								MIXS:0000706						light intensity			
light_regm			light regimen							Information about treatment(s) involving exposure to light, including both light intensity and quality.						incandescant light;10 lux;450 nanometer	https://microbiomedata/schema/mixs									core field												false				TextValue								MIXS:0000569			{text};{float} {unit};{float} {unit}			light regimen			
light_type			light type							Application of light to achieve some practical or aesthetic effect. Lighting includes the use of both artificial light sources such as lamps and light fixtures, as well as natural illumination by capturing daylight. Can also include absence of light						desk lamp	https://microbiomedata/schema/mixs									core field												true				light_type_enum								MIXS:0000769						light type			
link_addit_analys			links to additional analysis							Link to additional analysis results performed on the sample							https://microbiomedata/schema/mixs									core field												false				TextValue								MIXS:0000340			{PMID}|{DOI}|{URL}			links to additional analysis			
link_class_info			link to classification information							Link to digitized soil maps or other soil classification information							https://microbiomedata/schema/mixs									core field												false				TextValue								MIXS:0000329			{PMID}|{DOI}|{URL}			link to classification information			
link_climate_info			link to climate information							Link to climate resource							https://microbiomedata/schema/mixs									core field												false				TextValue								MIXS:0000328			{PMID}|{DOI}|{URL}			link to climate information			
lithology			lithology							"Hydrocarbon resource main lithology (Additional information: http://petrowiki.org/Lithology_and_rock_type_determination). If ""other"" is specified, please propose entry in ""additional info"" field"						Volcanic	https://microbiomedata/schema/mixs									core field												false				lithology_enum								MIXS:0000990						lithology			
local_class			soil_taxonomic/local classification							Soil classification based on local soil classification system							https://microbiomedata/schema/mixs									core field												false				TextValue								MIXS:0000330			{text}			soil_taxonomic/local classification			
local_class_meth			soil_taxonomic/local classification method							Reference or method used in determining the local soil classification							https://microbiomedata/schema/mixs									core field												false				TextValue								MIXS:0000331			{PMID}|{DOI}|{URL}			soil_taxonomic/local classification method			
magnesium			magnesium							Concentration of magnesium in the sample						52.8 micromole per kilogram	https://microbiomedata/schema/mixs									core field												false				QuantityValue								MIXS:0000431						magnesium			
max_occup			maximum occupancy							The maximum amount of people allowed in the indoor environment							https://microbiomedata/schema/mixs									core field												false				integer								MIXS:0000229						maximum occupancy			
mean_frict_vel			mean friction velocity							Measurement of mean friction velocity						0.5 meter per second	https://microbiomedata/schema/mixs									core field												false				QuantityValue								MIXS:0000498						mean friction velocity			
mean_peak_frict_vel			mean peak friction velocity							Measurement of mean peak friction velocity						1 meter per second	https://microbiomedata/schema/mixs									core field												false				QuantityValue								MIXS:0000502						mean peak friction velocity			
